excel_row,route_name,normalized_address
15,курск юз,"305023, Курская область, город Курск, 2-й Шоссейный переулок, 23, 8"
16,курск юз,"Курская область, город Курск, улица Энгельса, 109А"
18,курск юз,"Курская область, город Курск, улица Энергетиков, 120"
19,курск юз,"Курская область, город Курск, улица Энергетиков, 2"
20,курск юз,"305018, Курская область, город Курск, проспект Кулакова, 146"
21,курск юз,"305025, Курская область, город Курск, Магистральный проезд, 10а"
23,курск юз,"305025, Курская область, город Курск, Магистральный проезд, 1А"
25,курск юз,"305025, Курская область, город Курск, Магистральная улица, 1"
26,курск юз,"305524, Курская область, Курский район, сельское поселение Рышковский, улица Елисеева, 2"
