excel_row,route_name,normalized_address
102,Тамбов 3,"393550, Тамбовская область, Токаревский район, рабочий поселок Токаревка, Промзона улица, 3"
103,Тамбов 3,"392543, Тамбовская область, Тамбовский район, поселок совхоза ""Комсомолец"", Центральная улица, 57"
104,Тамбов 3,"392000, Тамбовская область, город Тамбов, Ипподромная улица, 8а"
105,Тамбов 3,"392028, Тамбовская область, город Тамбов, Ипподромная улица, 22а"
106,Тамбов 3,"392018, Тамбовская область, город Тамбов, Мичуринская улица, 48"
107,Тамбов 3,"392000, Тамбовская область, город Моршанск, улица Сакко и Ванцетти, 51А"
108,Тамбов 3,"393943, Тамбовская область, Моршанский район, город Моршанск, улица Речная, 13"
109,Тамбов 3,"393940, Тамбовская область, Моршанский район, село Алгасово, Садовая улица, 1"
